h1 /Title,h2/meta,body,1. h3,"Billboard Hot 100 (USA) - 1., 1992. január 25 - 1992. december 31.",Official Charts (UK),Offizielle Deutsche Charts (DE) ,2. h3,YouTube link,YouTube beágyazás link,Adatlap készítésének dátuma,Megtekintések,Like-ok száma,Dislike-ok száma,Kommentek száma,3. h3,Dal,Előadó - címke 1,Album,Műfaj,Kiadás éve,Díjak,4. h3,Wikipedia ,Deezer,Spotify,Google Play,5. h3,Dalszöveg link
Wannabe - Spice Girls - 1996,A Wannabe című dal a Spice Girls angol lánycsoport debütáló kislemezeként jelent meg. ,,Wannabe a zenei listákon,"=HYPERLINK(""https://www.billboard.com/charts/hot-100/1997-02-22"",""Billboard Hot 100 (USA) - 1., 1997. február 22. - 1997. március 22."")","=HYPERLINK(""https://www.officialcharts.com/search/singles/wannabe/"",""Official Charts (UK) - 1., 1996. július 20."")","=HYPERLINK(""https://www.offiziellecharts.de/titel-details-3278"",""Offizielle Deutsche Charts (DE) - 1., 1996. augusztus 12."")",Spice Girls Wannabe a YouTube oldalán,https://www.youtube.com/watch?v=gJLIiF15wjQ,https://youtu.be/gJLIiF15wjQ,2019. szeptember 22-én,"425,474,093 megtekintés",2.4M like,108K dislike,"97,859 komment",Spice Girls Wannabe című dalának adatai,Wannabe,Spice Girls,Spice,Pop,1996,,Tudj meg még többet Spice Girls Wannabe című daláról,"=HYPERLINK(""https://en.wikipedia.org/wiki/Wannabe"",""Wikipedia "")","=HYPERLINK(""https://www.deezer.com/hu/track/3164155?autoplay=true"",""Deezer"")","=HYPERLINK(""https://open.spotify.com/album/3x2jF7blR6bFHtk4MccsyJ"",""Spotify"")","=HYPERLINK(""https://play.google.com/music/preview/Tthbwrv6wrns5l7pdwokteoj67i?play=1&u=0"",""Google Play"")",Spice Girls Wannabe dalszöveg,"=HYPERLINK(""https://www.azlyrics.com/lyrics/spicegirls/wannabe.html"",""Spice Girls Wannabe dalszöveg"")"
Can't Nobody Hold Me Down - Puff Daddy - 1997,"A Can't Nobody Hold Me Down című dal Puff Diddy debütáló kislemeze, mely 1997-ben jelent meg. A dal hat hétig vezette a Billboard Hot 100-as listáját. ","A dal több korábbi kislemez elemeit ötvözi, amelyek közül a legnyilvánvalóbb a Grandmaster Flash és a Furious Five.",Can't Nobody Hold Me Down a zenei listákon,"=HYPERLINK(""https://www.billboard.com/charts/hot-100/1997-03-22"",""Billboard Hot 100 (USA) - 1., 1997. március 22. - 1997. május 3."")","=HYPERLINK(""https://www.officialcharts.com/search/singles/can't%20nobody%20hold%20me%20down/"",""Official Charts (UK) - 19., 1997. március 29."")","=HYPERLINK(""https://www.offiziellecharts.de/titel-details-3453"",""Offizielle Deutsche Charts (DE) - 23., 1997. április 7."")",Puff Daddy Can't Nobody Hold Me Down a YouTube oldalán,https://www.youtube.com/watch?v=qMh_VsTuXtE,https://youtu.be/qMh_VsTuXtE,2019. szeptember 22-én,"9,172,478 megtekintés",55K like,2.3K dislike,"2,081 komment",Puff Daddy Can't Nobody Hold Me Down című dalának adatai,Can't Nobody Hold Me Down,Puff Daddy,No Way Out,Hip-Hop/Rap,1997,"Jelölés: Grammy-díj: Duó vagy a csoport legjobb rap-előadás, Jelölés: Billboard Music Award: A legjobb rap dal",Tudj meg még többet Puff Daddy Can't Nobody Hold Me Down című daláról,"=HYPERLINK(""https://en.wikipedia.org/wiki/Can%27t_Nobody_Hold_Me_Down"",""Wikipedia "")","=HYPERLINK(""https://www.deezer.com/hu/track/3829298?autoplay=true"",""Deezer"")","=HYPERLINK(""https://open.spotify.com/album/4OGaOZUHLhSeiicZB909aL"",""Spotify"")","=HYPERLINK(""https://play.google.com/music/preview/Tra77ljriab32xfm3wofzu6avru?play=1&u=0"",""Google Play"")",Puff Daddy Can't Nobody Hold Me Down dalszöveg,"=HYPERLINK(""https://www.azlyrics.com/lyrics/puffdaddy/cantnobodyholdmedown.html"",""Puff Daddy Can't Nobody Hold Me Down dalszöveg"")"
Hypnotize - The Notorious B.I.G. - 1997,A Hypnotize című dal 1997-ben március 1-én jelent meg egy héttel a raper halála előtt. The Notorius B.I.G 1997. március 7-én lövöldözés közben életévesztette. 1997.május 3-án a dal elérte a Billboard Hot 100-as lista első helyét és heteken át vezette. ,"Christopher George Latore Wallace, művésznevén The Notorious B.I.G 1997. március 9-én halt meg, egy ismeretlen tettes lövéseket adott le Wallace autójára, megölve ezzel Wallace-t. Life After Death című lemeze, melyen a Hypnotize című dal is megtalálható, tizenöt nappal később jelent meg, és egyből az első helyen debütált a listákon.",Hypnotize a zenei listákon,"=HYPERLINK(""https://www.billboard.com/charts/hot-100/1997-05-03"",""Billboard Hot 100 (USA) - 1., 1997. május 3. - 1997. május 24."")","=HYPERLINK(""https://www.officialcharts.com/search/singles/hypnotize/"",""Official Charts (UK) - 10., 1997. május 3."")","=HYPERLINK(""https://www.offiziellecharts.de/titel-details-19933"",""Offizielle Deutsche Charts (DE) - 15., 1997. május 26."")",The Notorious B.I.G. Hypnotize a YouTube oldalán,https://www.youtube.com/watch?v=glEiPXAYE-U,https://youtu.be/glEiPXAYE-U,2019. szeptember 23-án,"57,936,537 megosztás",276K like,12K dislike,"11,632 komment",The Notorious B.I.G. Hypnotize című dalának adatai,Hypnotize,The Notorious B.I.G.,Life After Death,Hip-Hop/Rap,1997,,Tudj meg még többet The Notorious B.I.G. Hypnotize című daláról,"=HYPERLINK(""https://en.wikipedia.org/wiki/Hypnotize_(The_Notorious_B.I.G._song)"",""Wikipedia "")","=HYPERLINK(""https://www.deezer.com/hu/track/81829048?autoplay=true"",""Deezer"")","=HYPERLINK(""https://open.spotify.com/album/5XqEf16OrHdmMoNS1b6WDg"",""Spotify"")","=HYPERLINK(""https://play.google.com/music/preview/Tjpgrln7egilzqzih6luvywa46a?play=1&u=0"",""Google Play"")",The Notorious B.I.G. Hypnotize dalszöveg,"=HYPERLINK(""https://www.azlyrics.com/lyrics/notoriousbig/hypnotize.html"",""The Notorious B.I.G. Hypnotize dalszöveg"")"
MMMBop - Hanson - 1997,"Az MMMBop című dal a zenekar legsikeresebb műve, a dalt két Grammy- ra jelölték. A Billboard Hot 100-as listát három hétig vezette. ","A dalt, a The Village Voice Pazz & Jop kritikusok közvélemény-kutatásán az év legjobb kislemezévé választották.",MMMBop a zenei listákon,"=HYPERLINK(""https://www.billboard.com/charts/hot-100/1997-05-24"",""Billboard Hot 100 (USA) - 1., 1997. május 24. - 1997. június 14."")",-,"=HYPERLINK(""https://www.offiziellecharts.de/titel-details-3461"",""Offizielle Deutsche Charts (DE) - 1., 1997. június 9."")",Hanson MMMBop a YouTube oldalán,https://www.youtube.com/watch?v=NHozn0YXAeE,https://youtu.be/NHozn0YXAeE,2019. szeptember 23-án,"90,008,021 megtekintés",342K like,21K dislike,"38,994 komment",Hanson MMMBop című dalának adatai,MMMBop,Hanson,Middle of Nowhere,Pop,1997,"Jelölés: Grammy-díj az év lemeze,Grammy-díj a duó vagy énekcsoport együttes legjobb pop-előadásáért",Tudj meg még többet Hanson MMMBop című daláról,"=HYPERLINK(""https://en.wikipedia.org/wiki/MMMBop"",""Wikipedia "")","=HYPERLINK(""https://www.deezer.com/hu/track/17936082?autoplay=true"",""Deezer"")","=HYPERLINK(""https://open.spotify.com/album/1SNNc4pb0aA0GS2PsLr5b5"",""Spotify"")","=HYPERLINK(""https://play.google.com/music/preview/Tckuwaefmgeu6kry4ilofkauwim?play=1&u=0"",""Google Play"")",Hanson MMMBop dalszöveg,"=HYPERLINK(""https://www.azlyrics.com/lyrics/hanson/mmmbop.html"",""Hanson MMMBop dalszöveg"")"
I'll Be Missing You - Puff Daddy & Faith Evans Featuring 112 - 1997,"A dal minden idők egyik legkelendőbb kislemezévé volt, a Billboard Hot 100-as listát 11 hétig vezette.","A dal The Notorious BIG, emlékére készült, akit meggyilkoltak 1997 márciusában. 1998-ban a dal Grammy díjat nyert, legjobb rap előadás kategóriában. ",I'll Be Missing You a zenei listákon,"=HYPERLINK(""https://www.billboard.com/charts/hot-100/1997-06-14"",""Billboard Hot 100 (USA) - 1., 1997. június 14. - 1997. augusztus 30."")","=HYPERLINK(""https://www.officialcharts.com/search/singles/i'll%20be%20missing%20you/"",""Official Charts (UK) - 1., 1997. június 14."")","=HYPERLINK(""https://www.offiziellecharts.de/titel-details-3475"",""Offizielle Deutsche Charts (DE) - 1., 1997. június 23."")",Puff Daddy & Faith Evans Featuring 112 I'll Be Missing You a YouTube oldalán,https://www.youtube.com/watch?v=NKMtZm2YuBE,https://youtu.be/NKMtZm2YuBE,2019. szeptember 23-án,"17,332,378 megtekintés",178K like,5.9K dislike,"7,785 komment",Puff Daddy & Faith Evans Featuring 112 I'll Be Missing You című dalának adatai,I'll Be Missing You,Puff Daddy & Faith Evans Featuring 112,No Way Out,Hip-Hop/Rap,1997,"Grammy-díj: A legjobb rap-előadás duó vagy csoport kategóriában,  Billboard Music Award: A legjobb rap dal",Tudj meg még többet Puff Daddy & Faith Evans Featuring 112 I'll Be Missing You című daláról,"=HYPERLINK(""https://en.wikipedia.org/wiki/I%27ll_Be_Missing_You"",""Wikipedia "")","=HYPERLINK(""https://www.deezer.com/hu/track/3829297?autoplay=true"",""Deezer"")","=HYPERLINK(""https://open.spotify.com/album/46JQVqJpOg8opDLUl1qHT1"",""Spotify"")","=HYPERLINK(""https://play.google.com/music/preview/T7pgmoqngjmiuwgwkmai3sod6ne?play=1&u=0"",""Google Play"")",Puff Daddy & Faith Evans Featuring 112 I'll Be Missing You dalszöveg,"=HYPERLINK(""https://genius.com/Diddy-ill-be-missing-you-lyrics"",""Puff Daddy & Faith Evans Featuring 112 I'll Be Missing You dalszöveg"")"
Mo Money Mo Problems - The Notorious B.I.G. Featuring Puff Daddy & Mase,"Az 1997-ben megjelent Mo Money Mo Problems kislemez posztumuszként jelent meg, két hétig vezette Billboard Hot 100-as listáját. ","A dal a Notorious BIG második posztumális kislemeze, amely a Hypnotize után következett. A Billboard Hot 100-as lista történetében az egyetlen előadó, akinek posztumálisan két első helyezett kislemeze is megjelent. ",Mo Money Mo Problems a zenei listákon,"=HYPERLINK(""https://www.billboard.com/charts/hot-100/1997-08-30"",""Billboard Hot 100 (USA) - 1., 1997. augusztus 30. - 1997. szeptember 13."")","=HYPERLINK(""https://www.officialcharts.com/search/singles/mo%20money%20mo%20problems/"",""Official Charts (UK) - 6., 1997. augusztus 9."")","=HYPERLINK(""https://www.offiziellecharts.de/titel-details-3520"",""Offizielle Deutsche Charts (DE) - 11., 1997. augusztus 4."")",The Notorious B.I.G. Featuring Puff Daddy & Mase Mo Money Mo Problems a YouTube oldalán,https://www.youtube.com/watch?v=gUhRKVIjJtw,https://youtu.be/gUhRKVIjJtw,2019. szeptember 23-án,"52,428,007 megtekintés",264K like,10K dislike,"12,375 komment",The Notorious B.I.G. Featuring Puff Daddy & Mase Mo Money Mo Problems című dalának adatai,Mo Money Mo Problems,The Notorious B.I.G. Featuring Puff Daddy & Mase, Life After Death,Hip-Hop/Rap,1997,"Jelölés:  Grammy-díj: A legjobb rap-előadás duó vagy zenekar kategóriában, MTV Video Music Award a legjobb rap-videó",Tudj meg még többet The Notorious B.I.G. Featuring Puff Daddy & Mase Mo Money Mo Problems című daláról,"=HYPERLINK(""https://en.wikipedia.org/wiki/Mo_Money_Mo_Problems"",""Wikipedia "")","=HYPERLINK(""https://www.deezer.com/hu/track/82742954?autoplay=true"",""Deezer"")","=HYPERLINK(""https://open.spotify.com/album/46JQVqJpOg8opDLUl1qHT1"",""Spotify"")","=HYPERLINK(""https://play.google.com/music/preview/Tgpdkbiirin5tvlbxhaqj3ok4ly?play=1&u=0"",""Google Play"")",The Notorious B.I.G. Featuring Puff Daddy & Mase Mo Money Mo Problems dalszöveg,"=HYPERLINK(""https://genius.com/The-notorious-big-mo-money-mo-problems-lyrics"",""The Notorious B.I.G. Featuring Puff Daddy & Mase Mo Money Mo Problems dalszöveg"")"
Honey - Mariah Carey - 1997,"A albumot 1997. augusztus 26-án adta ki a Columbia Records, mint a hatodik Butterfly (1997) stúdió-album vezető kislemeze. A Honey című dal három hétig vezette a Billboard Hot 100-as listát. ","A Honey című dalt két kategóriában jelölték a 40. éves Grammy-díjon , a legjobb női R&B ének teljesítésért és a Legjobb R&B dalért .",Honey a zenei listákon,"=HYPERLINK(""https://www.billboard.com/charts/hot-100/1997-09-13"",""Billboard Hot 100 (USA) - 1., 1997. szeptember 13. - 1997. október 4."")","=HYPERLINK(""https://www.officialcharts.com/search/singles/honey/"",""Official Charts (UK) - 3., 1997. szeptember 6."")","=HYPERLINK(""https://www.offiziellecharts.de/titel-details-3529"",""Offizielle Deutsche Charts (DE) - 38., 1997. szeptember 8."")",Mariah Carey Honey a YouTube oldalán,https://www.youtube.com/watch?v=w3KOowB4k_k,https://youtu.be/w3KOowB4k_k,2019. szeptember 25-én,"39,834,010 megtekintés",105K like,5.6K dislike,"7,700 komment",Mariah Carey Honey című dalának adatai,Honey,Mariah Carey,Butterfly,"R&B, Hip-hop",1997,"Jelölés:  Grammy-díj: A legjobb női R&B ének, A Legjobb R&B dal",Tudj meg még többet Mariah Carey Honey című daláról,"=HYPERLINK(""https://en.wikipedia.org/wiki/Honey_(Mariah_Carey_song)"",""Wikipedia "")","=HYPERLINK(""https://www.deezer.com/hu/track/4269178?autoplay=true"",""Deezer"")","=HYPERLINK(""https://open.spotify.com/album/7aDBFWp72Pz4NZEtVBANi9"",""Spotify"")","=HYPERLINK(""https://play.google.com/music/preview/Tbimxntgmf7vcd6epbg6wsqvrde?play=1"",""Google Play"")",Mariah Carey Honey dalszöveg,"=HYPERLINK(""https://genius.com/Mariah-carey-honey-lyrics"",""Mariah Carey Honey dalszöveg"")"
4 Seasons Of Loneliness - Boyz II Men,"4 Seasons Of Loneliness című dal Jimmy Jam és Terry Lewis írta és készítette, az Evolution album első albumaként jelent meg 1997-ben. Egy hétig vezette a Billboard Hot 100-as listát. ","4 Seasons Of Loneliness című dal, mai napig az utolsó számú pop-sláger a Motown lemezrekord alatt.",4 Seasons Of Loneliness a zenei listákon,"=HYPERLINK(""https://www.billboard.com/charts/hot-100/1997-10-04"",""Billboard Hot 100 (USA) - 1., 1997. október 4. - 1997. október 11."")","=HYPERLINK(""https://www.officialcharts.com/search/singles/4%20seasons%20of%20loneliness/"",""Official Charts (UK) - 10., 1997. szeptember 20."")","=HYPERLINK(""https://www.offiziellecharts.de/titel-details-3539"",""Offizielle Deutsche Charts (DE) - 59., 1997. szeptember 29."")",Boyz II Men 4 Seasons Of Loneliness a YouTube oldalán,https://www.youtube.com/watch?v=fUSOZAgl95A,https://youtu.be/fUSOZAgl95A,2019. szeptember 25-én,"26,187,392 megtekintés",74K like,3.4K dislike,"3,082 komment",Boyz II Men 4 Seasons Of Loneliness című dalának adatai,4 Seasons Of Loneliness,Boyz II Men, Evolution,Contemporary R&B,1997,Jelölés: NAACP Image Award a kiemelkedő zenei videóért,Tudj meg még többet Boyz II Men 4 Seasons Of Loneliness című daláról,"=HYPERLINK(""https://en.wikipedia.org/wiki/4_Seasons_of_Loneliness"",""Wikipedia "")","=HYPERLINK(""https://www.deezer.com/hu/track/72549994?autoplay=true"",""Deezer"")","=HYPERLINK(""https://open.spotify.com/album/3ZmM5U2amDgT3jQTYrVPVi"",""Spotify"")","=HYPERLINK(""https://play.google.com/music/preview/Tl6pcd6yjgh2wtovtqq2dhvvui4?play=1"",""Google Play"")",Boyz II Men 4 Seasons Of Loneliness dalszöveg,"=HYPERLINK(""https://www.azlyrics.com/lyrics/boyziimen/fourseasonsofloneliness.html"",""Boyz II Men 4 Seasons Of Loneliness dalszöveg"")"
Candle In The Wind 1997 - Elton John -1997,"Candle in the Wind 1997 című dal egy 1973-as dal újra dolgozott változata. 14 hétig vezette a Billboard Hot 100-as listáját, továbbá a legkelendőbb kislemez volt a Billboard történetében. ","A dalt 1997. szeptember 13-án adták ki Diana, a walesi hercegnő tiszteletére. A dalt Taupin írta, Sir George Martin készítette , és a történelem második legkelendőbb kislemeze.",Candle in the Wind 1997 a zenei listákon,"=HYPERLINK(""https://www.billboard.com/charts/hot-100/1997-10-11"",""Billboard Hot 100 (USA) - 1., 1997. október 11. - 1998. január 17."")",-,"=HYPERLINK(""https://www.offiziellecharts.de/titel-details-3524"",""Offizielle Deutsche Charts (DE) - 1., 1997. szeptember 22."")",Elton John Candle In The Wind 1997 a YouTube oldalán,https://www.youtube.com/watch?v=V0PKcKbjlKg,https://youtu.be/V0PKcKbjlKg,2019. szeptember 25-én,"2,444,313 megtekintés",5.8K like,154 dislike,663 komment,Elton John Candle In The Wind 1997 című dalának adatai,Candle In The Wind 1997,Elton John,Something About the Way You Look Tonight,Pop,1997," Grammy-díj: A legjobb férfi pop vokális előadás, Billboard Music Award: A legjobb 100 dal",Tudj meg még többet Elton John - Candle In The Wind 1997 című daláról,"=HYPERLINK(""https://en.wikipedia.org/wiki/Candle_in_the_Wind_1997"",""Wikipedia "")","=HYPERLINK(""https://www.deezer.com/hu/track/20462771?autoplay=true"",""Deezer"")","=HYPERLINK(""https://open.spotify.com/album/3g61rwvRs1NPeVBxuAMmHZ"",""Spotify"")","=HYPERLINK(""https://play.google.com/music/preview/Ty3fqrhhfbk4ti4ysig7cwgnaam?play=1"",""Google Play"")",Elton John Candle In The Wind 1997 dalszöveg,"=HYPERLINK(""https://genius.com/Elton-john-candle-in-the-wind-1997-lyrics"",""Elton John Candle In The Wind 1997 dalszöveg"")"
